id	title	name	publication_date	body	new_title
1102114	ABC HOSTS 2019 DEMOCRATIC PRESIDENTIAL CANDIDATES DEBATES IN HOUSTON	Amy Klobuchar	2019-09-12	What changes did we make, go after white-collar crime in a big way. Diversify the office in a big way. Work with the Innocence Project to make sure we do much better with eyewitness ID. And as a senator and as your president, I will make sure that we don't just do the first step act when it comes to criminal sentencing, that we move to the second step act, which means that 90 percent of people that are incarcerated in local and state jails, let's reduce those sentences for nonviolent offenders and let's get them jobs and let them vote when they get out of prison.	Democratic Presidential Debate - September 12 | ABC
1102115	ABC HOSTS 2019 DEMOCRATIC PRESIDENTIAL CANDIDATES DEBATES IN HOUSTON	Joe Biden	2019-09-12	Well, first of all, let me say that when I came back from law school, I had a job with great--a big-time law firm and left and became a public defender because my state was under siege. When Doctor King was assassinated, we were occupied by the National Guard for 10 months. I've been involved from the beginning. As a young congressman--as a young councilman, I introduced legislation to try to keep them putting a sewer plant in the poor neighborhood. I made sure that we dealt with redlining. Banks should have to lend where they operated, et cetera.	Democratic Presidential Debate - September 12 | ABC
1102116	ABC HOSTS 2019 DEMOCRATIC PRESIDENTIAL CANDIDATES DEBATES IN HOUSTON	Joe Biden	2019-09-12	The fact of the matter is that what's happened is that we are in a situation now where there are so many people who are in jail and shouldn't be in jail. The whole means by which this should change is the whole model has to change. We should be talking about rehabilitation. Nobody should be in jail for a nonviolent crime. As--when we are in the White House, we released 36,000 people from the federal prison system. Nobody should be in jail for a drug problem. They should be going directly to a rehabilitation--we build more rehabilitation centers, not prisons.	Democratic Presidential Debate - September 12 | ABC
1102117	ABC HOSTS 2019 DEMOCRATIC PRESIDENTIAL CANDIDATES DEBATES IN HOUSTON	Joe Biden	2019-09-12	We--I'm the guy that put in the--the drug courts to divert people from the criminal justice system. And so we have to change the whole way we look at this. When we put people in prison, we have to equip them when they get out. Nobody who got in prison for marijuana, for example, immediately upon being released, they shouldn't be in there for a--a Mr.--that should be a misdemeanor. They should be out, and their record should be expunged.	Democratic Presidential Debate - September 12 | ABC
1102118	ABC HOSTS 2019 DEMOCRATIC PRESIDENTIAL CANDIDATES DEBATES IN HOUSTON	Joe Biden	2019-09-12	Every single right should be your term. When you finish your term in prison you should be able to not only vote but have access to Pell Grants, have access to be able to get housing, have access to be able to move along the way.	Democratic Presidential Debate - September 12 | ABC
1102119	ABC HOSTS 2019 DEMOCRATIC PRESIDENTIAL CANDIDATES DEBATES IN HOUSTON	Joe Biden	2019-09-12	I've laid out a detailed plan along those lines. And the fact is we've learned so much more--	Democratic Presidential Debate - September 12 | ABC
1102120	ABC HOSTS 2019 DEMOCRATIC PRESIDENTIAL CANDIDATES DEBATES IN HOUSTON	Cory Booker	2019-09-12	Our criminal justice system is so savagely broken. There's no difference in America between blacks, whites and Latinos for using drugs or dealing drugs. But if you're African American you're almost four times more likely to be arrested and incarcerated destroying your lives. And so much of this comes down to privilege. We have a criminal justice system that Brian Stephenson says treats you better if you're rich and guilty than if you're poor and innocent. And so, I have challenged this whole field--we can specifically and demonstratedly now show that there are 17,000 people unjustly incarcerated in America and all of us should come forward and say when we are president of the United States, when I am president of the United States we will release them.	Democratic Presidential Debate - September 12 | ABC
1102121	ABC HOSTS 2019 DEMOCRATIC PRESIDENTIAL CANDIDATES DEBATES IN HOUSTON	Cory Booker	2019-09-12	And let me be specific--I--I joined tighter and led in the United States Senate the only major bipartisan bill passed under this president for criminal justice reform that has already led to thousands of people coming out of jail. If 87 members of the United States senate says that these sentences are way too long and we changed it, but we didn't make it retroactive we can literally point to the people that are in jail unjustly right now. Everyone on this stage should say that we are going to give clemency to these 17,000 people.	Democratic Presidential Debate - September 12 | ABC
1102122	ABC HOSTS 2019 DEMOCRATIC PRESIDENTIAL CANDIDATES DEBATES IN HOUSTON	Cory Booker	2019-09-12	And, I challenge you. Don't just say big statements. Back it up with details of the people in prison right now looking for one of the most sacrosanct ideals of this nation--which is liberty and freedom. We need to reform the system and we must do it now. Every day that we wait--	Democratic Presidential Debate - September 12 | ABC
1102123	ABC HOSTS 2019 DEMOCRATIC PRESIDENTIAL CANDIDATES DEBATES IN HOUSTON	Cory Booker	2019-09-12	--is too long.	Democratic Presidential Debate - September 12 | ABC
1102124	ABC HOSTS 2019 DEMOCRATIC PRESIDENTIAL CANDIDATES DEBATES IN HOUSTON	Joe Biden	2019-09-12	Because we got it done before--I'm the only one up here who has ever beat the NRA. Only one that ever beat the NRA nationally. I'm the guy that brought the Brady Bill and the--and the--into focus and became law. And so, that's number one.	Democratic Presidential Debate - September 12 | ABC
1102125	ABC HOSTS 2019 DEMOCRATIC PRESIDENTIAL CANDIDATES DEBATES IN HOUSTON	Joe Biden	2019-09-12	Number two, after Sandy Hook a number of things happened. This went form a cause to a movement. Look what's happened now--Mothers--the organization, Mothers Against Violence this in--gun violence. We've seen what's happened again. Now, we have all these young people marching on Washington making sure that things are going to change. There has been a sea change. Those proposals I put forward for the President had over 50 percent of--of gun--of gun--for members of the NRA supporting them and overwhelmingly the rest of the people supporting them.	Democratic Presidential Debate - September 12 | ABC
1102126	ABC HOSTS 2019 DEMOCRATIC PRESIDENTIAL CANDIDATES DEBATES IN HOUSTON	Joe Biden	2019-09-12	Now, the numbers are much higher because they realize what I've been saying and we've all been saying is correct. Over 90 percent of the American people think we have to get assault weapons off the street. Period. And we have to get buy backs and get them out of their basements.	Democratic Presidential Debate - September 12 | ABC
1102127	ABC HOSTS 2019 DEMOCRATIC PRESIDENTIAL CANDIDATES DEBATES IN HOUSTON	Joe Biden	2019-09-12	So, the point is--things have changed and things have changed a lot. And now, what's happening is--and by the way, the way Beto handled--excuse me, for saying Beto, Congressman.	Democratic Presidential Debate - September 12 | ABC
1102128	ABC HOSTS 2019 DEMOCRATIC PRESIDENTIAL CANDIDATES DEBATES IN HOUSTON	Beto O'Rourke	2019-09-12	It's all right. Beto is good.	Democratic Presidential Debate - September 12 | ABC
1102129	ABC HOSTS 2019 DEMOCRATIC PRESIDENTIAL CANDIDATES DEBATES IN HOUSTON	Joe Biden	2019-09-12	The way he handled what happened in his hometown is--the look in the eyes of those people to see those kids, to understand those parents--	Democratic Presidential Debate - September 12 | ABC
1102130	ABC HOSTS 2019 DEMOCRATIC PRESIDENTIAL CANDIDATES DEBATES IN HOUSTON	Joe Biden	2019-09-12	--to understand the heartache. We are ready to do this.	Democratic Presidential Debate - September 12 | ABC
1102131	ABC HOSTS 2019 DEMOCRATIC PRESIDENTIAL CANDIDATES DEBATES IN HOUSTON	Beto O'Rourke	2019-09-12	Thank you.	Democratic Presidential Debate - September 12 | ABC
1102132	ABC HOSTS 2019 DEMOCRATIC PRESIDENTIAL CANDIDATES DEBATES IN HOUSTON	Kamala Harris	2019-09-12	That's right.	Democratic Presidential Debate - September 12 | ABC
1102133	ABC HOSTS 2019 DEMOCRATIC PRESIDENTIAL CANDIDATES DEBATES IN HOUSTON	Joe Biden	2019-09-12	Some things you can. Many things you can't.	Democratic Presidential Debate - September 12 | ABC
1102134	ABC HOSTS 2019 DEMOCRATIC PRESIDENTIAL CANDIDATES DEBATES IN HOUSTON	Kamala Harris	2019-09-12	I mean I would just say hey, Joe, instead of saying on, we can't let's say yes, we can. (LAUGHTER)	Democratic Presidential Debate - September 12 | ABC
1102135	ABC HOSTS 2019 DEMOCRATIC PRESIDENTIAL CANDIDATES DEBATES IN HOUSTON	Joe Biden	2019-09-12	Let's be constitutional. Got a constitution.	Democratic Presidential Debate - September 12 | ABC
1102136	ABC HOSTS 2019 DEMOCRATIC PRESIDENTIAL CANDIDATES DEBATES IN HOUSTON	Kamala Harris	2019-09-12	Yes, we can because I'll tell you something--the way that I think about this is I've seen more autopsy photographs than I care to tell you.	Democratic Presidential Debate - September 12 | ABC
1102137	ABC HOSTS 2019 DEMOCRATIC PRESIDENTIAL CANDIDATES DEBATES IN HOUSTON	Kamala Harris	2019-09-12	I have attended more police officer funerals than like care to tell you. I have hugged more mothers of homicide victims than I care to tell you and the idea that we would wait for this Congress which has just done nothing to act is just it is--it is overlooking the fact that every day in America our babies are going to school to have drills elementary, middle, and high school students where they are learning about how they have to hide in a closet or crouch in a corner if there is a mass shooter roaming the hallways of their school.	Democratic Presidential Debate - September 12 | ABC
1102138	ABC HOSTS 2019 DEMOCRATIC PRESIDENTIAL CANDIDATES DEBATES IN HOUSTON	Kamala Harris	2019-09-12	I was talking about this at one of my town halls and--and--and this child was eight years old probably came up to me it was like it was a secret between the two of us and he tugged on my jacket and he said I had to have one of those drills. It is traumatizing our children. El Paso and, Beto, God love you for standing so courageously in the midst of that tragedy.	Democratic Presidential Debate - September 12 | ABC
1102139	ABC HOSTS 2019 DEMOCRATIC PRESIDENTIAL CANDIDATES DEBATES IN HOUSTON	Kamala Harris	2019-09-12	You know people ask me and El Paso they said because I have a long-standing record on this issue they said well, do you think Trump is responsible for what happened. I said well, look, I mean obviously he didn't pull the trigger but he has certainly been tweeting out the ammunition.	Democratic Presidential Debate - September 12 | ABC
1102140	ABC HOSTS 2019 DEMOCRATIC PRESIDENTIAL CANDIDATES DEBATES IN HOUSTON	Joe Biden	2019-09-12	What I said was the question speak to constitutional scholars. If in fact we could say by the way you can't own the following weapons, they cannot be sold anymore. Check with constitutional scholars. Now you can say--	Democratic Presidential Debate - September 12 | ABC
1102141	ABC HOSTS 2019 DEMOCRATIC PRESIDENTIAL CANDIDATES DEBATES IN HOUSTON	Kamala Harris	2019-09-12	Could I tell you what you could do--respond	Democratic Presidential Debate - September 12 | ABC
1102142	ABC HOSTS 2019 DEMOCRATIC PRESIDENTIAL CANDIDATES DEBATES IN HOUSTON	Beto O'Rourke	2019-09-12	I am if it is a weapon that was designed to kill people--	Democratic Presidential Debate - September 12 | ABC
1102143	ABC HOSTS 2019 DEMOCRATIC PRESIDENTIAL CANDIDATES DEBATES IN HOUSTON	Beto O'Rourke	2019-09-12	--on a battlefield; if they high impact high velocity round when it hits your body shreds everything inside of your body because it was designed to do that so that you would bleed to death on a battlefield and not be able to get up and kill one of our soldiers. When we see that being used against children and in Odessa I met the mother of a 15-year-old girl who was shot by an AR-15 and that mother watched her bleed to death over the course of an hour because so many other people were shot by that AR-15 in Odessa and Midland there weren't enough ambulances to get to them in time. Hell yes we are going to take your AR-15, your AK-47.	Democratic Presidential Debate - September 12 | ABC
1102144	ABC HOSTS 2019 DEMOCRATIC PRESIDENTIAL CANDIDATES DEBATES IN HOUSTON	Beto O'Rourke	2019-09-12	We are not going to allow it to be used against fellow Americans anymore.	Democratic Presidential Debate - September 12 | ABC
1102145	ABC HOSTS 2019 DEMOCRATIC PRESIDENTIAL CANDIDATES DEBATES IN HOUSTON	Beto O'Rourke	2019-09-12	I want to say this I am listening to the people of this country the day after I propose doing that I went to a gun show in Conway, Arkansas to meet with those who are selling AR-15 and AK-47s and those who are buying those weapons. And you might be surprised there was some common ground there. Folks who said I would willing give that up, cut it to pieces I don't need this weapon to hunt, to defend myself. It is a weapon of war. So let's do the right thing but let's bring everyone in America into the conversation Republicans, Democrats, gunowners and non-gunowners alike.	Democratic Presidential Debate - September 12 | ABC
1102146	ABC HOSTS 2019 DEMOCRATIC PRESIDENTIAL CANDIDATES DEBATES IN HOUSTON	Amy Klobuchar	2019-09-12	I so appreciate what the Congressman has been doing and I want to remind people here that what unites us is so much bigger than what divides us. Everyone appear favors an assault weapon ban. Everyone up here favors magazine limitations which by the way would have made a huge difference if that was in place and El Paso in that store were all of those ordinary people showed such extraordinary courage and certainly in Dayton, Ohio where in 30 seconds one man guns down innocent people. The cops got there in one minute and it still wasn't enough to save those people. That is what unites us. You know what else unites us and I will tell you this what unites us is that right now on Mitch McConnell's desk are three bills universal background checks, closing the Charleston loophole and passing my bill to make sure that domestic abusers don't get AK-47s.	Democratic Presidential Debate - September 12 | ABC
1102147	ABC HOSTS 2019 DEMOCRATIC PRESIDENTIAL CANDIDATES DEBATES IN HOUSTON	Amy Klobuchar	2019-09-12	So if you want to get something done and I personally think we should start with a voluntary--voluntary buyback program. That is my thing, David. You want to finish this because of you one action now, if you want action now we have got to send a message to Mitch McConnell. We can't wait until one of us gets in the White House. We have to pass those bills right now to get this done because we cannot spare another innocent lie.	Democratic Presidential Debate - September 12 | ABC
1102148	ABC HOSTS 2019 DEMOCRATIC PRESIDENTIAL CANDIDATES DEBATES IN HOUSTON	Cory Booker	2019-09-12	So background checks and gun licensing, these are agreed to by overwhelmingly the majority of Americans. 83 percent of Americans agree with licensing. This is the issue. Look, I grew up in the suburbs. It was about 20 years ago that I came out of my home when I moved to inner-city Newark, New Jersey and witness the aftermath of a shooting. It's one of the reasons why shooting after shooting after shooting in neighborhoods like mine for decades, this has been a crisis for me. It's why I was the first person to come out for gun licensing.	Democratic Presidential Debate - September 12 | ABC
1102149	ABC HOSTS 2019 DEMOCRATIC PRESIDENTIAL CANDIDATES DEBATES IN HOUSTON	Cory Booker	2019-09-12	And I'm happy that people like Beto O'Rourke are showing such courage now and coming forward and also now supporting licensing. But this is what I'm sorry about. I'm sorry that it had to take issues coming into my neighborhood or personally affecting Beto to suddenly make us demand change. This is a crisis of empathy in our nation. We are never going to solve this crisis if we have to wait for it to personally affect us or our neighborhood or our community before we demand action. You want to know how we get this done?	Democratic Presidential Debate - September 12 | ABC
1102150	ABC HOSTS 2019 DEMOCRATIC PRESIDENTIAL CANDIDATES DEBATES IN HOUSTON	Cory Booker	2019-09-12	We get this done by having a more courageous empathy where people don't wait for this hell to visit upon their communities, they stand up and understand the truth of what King said, that injustice anywhere is a threat to justice everywhere. I will lead to change--	Democratic Presidential Debate - September 12 | ABC
1102151	ABC HOSTS 2019 DEMOCRATIC PRESIDENTIAL CANDIDATES DEBATES IN HOUSTON	Cory Booker	2019-09-12	On this issue because I have seen what the carnage creates in communities like mine because we forget national shootings, these--these mass shootings are tragedies. But the majority of the homicide victims come from neighborhoods like mine. Nobody has ascended to the White House will bring more personal passion on this issue. I will fight this and bring fight to the NRA and the corporate gun lobby like they have never seen before.	Democratic Presidential Debate - September 12 | ABC
1102152	ABC HOSTS 2019 DEMOCRATIC PRESIDENTIAL CANDIDATES DEBATES IN HOUSTON	Cory Booker	2019-09-12	You know, if--if that was the attitude when Strom Thurmond had the longest filibuster ever on civil rights, if it was this idea that we can't get it done because of the situation in the Senate, I'm looking to lead a movement. The number one reason why governments are formed is to protect the citizenry. Think about this, we have had more people die due to gun violence in my lifetime than every single war in this country combined from the Revolutionary war till now. This is not a side issue to me. It is a central issue to me. That is the kind of fight because the majority of homicide victims, we have a mass shooting every single day in communities like mine. We must awaken a more courageous empathy in this country so that we stand together and fight together and overwhelm those Republicans who are not even representing their constituency because the majority of Americans, the majority of gun owners agree with me, not the corporate gun lobby. It is time for a movement on this issue, and I will lead it.	Democratic Presidential Debate - September 12 | ABC
1102153	ABC HOSTS 2019 DEMOCRATIC PRESIDENTIAL CANDIDATES DEBATES IN HOUSTON	Elizabeth Warren	2019-09-12	So let's start by framing the problem the right way. We have a gun violence problem in this country. The mass shootings are terrible. But they get all the headlines. Children die every day on streets, in neighborhoods, on playgrounds. People died from violence from suicide and domestic abuse. We have a gun violence problem in this country. And we agree on many steps we can take to fix it. My view on this is we're going to--it's not going to be one and done on this. We're going to do it, and we're going to have to do it again, and we're going to have to come back some more until we cut the number of gun deaths in this country significantly. But here's the deal. The question we need to ask is when we've got this much support across the country, 90 percent of Americans want to see us do, I like registration, want to see us do background checks, want to get assault weapons off the ground--off the streets, why doesn't it happen? And the answer is corruption, pure and simple.	Democratic Presidential Debate - September 12 | ABC
1102154	ABC HOSTS 2019 DEMOCRATIC PRESIDENTIAL CANDIDATES DEBATES IN HOUSTON	Elizabeth Warren	2019-09-12	We have a Congress that is beholden to the gun industry and unless we are willing to address that head on and roll back the filibuster, we're not going to get anything done on guns. I was in the United States Senate when 54 senators said let's do background checks, let's get rid of assault weapons. And with 54 senators, it failed because of the filibuster. Until we attack these systemic problems, we can't get gun reform in this country. We've got to go straight against the industry, and we've got to change Congress, so it doesn't just work for the wealthy and well-connected, so it works for the people.	Democratic Presidential Debate - September 12 | ABC
1102155	ABC HOSTS 2019 DEMOCRATIC PRESIDENTIAL CANDIDATES DEBATES IN HOUSTON	Bernie Sanders	2019-09-12	No. But what I would support absolutely, is passing major legislation. The gun legislation. The people here are talking about. Medicare for All. Climate change legislation that saves the planet. I will not wait for 60 votes to make that happen. And you can do it in a variety of ways. You can do that through budget reconciliation law. You have a vice president who will, in fact, tell the Senate what his appropriate and what is not--what is in order and what is not.	Democratic Presidential Debate - September 12 | ABC
1102156	ABC HOSTS 2019 DEMOCRATIC PRESIDENTIAL CANDIDATES DEBATES IN HOUSTON	Bernie Sanders	2019-09-12	What I want to get back to a point that Elizabeth made that, in fact, in terms of gun issues picking up on Cory and Beto and everybody else--what we are looking at is a corrupt political system and that means whether it is the drug companies or the insurance companies or the fossil fuel industry determining what's happening in Washington or in this case, you got an NRA, which has intimidated the president of the United States and the Republican leadership.	Democratic Presidential Debate - September 12 | ABC
1102157	ABC HOSTS 2019 DEMOCRATIC PRESIDENTIAL CANDIDATES DEBATES IN HOUSTON	Bernie Sanders	2019-09-12	I am proud. I am proud that year after year I had an F rating from the NRA. And as president I will not be intimidated by the NRA.	Democratic Presidential Debate - September 12 | ABC
1102158	ABC HOSTS 2019 DEMOCRATIC PRESIDENTIAL CANDIDATES DEBATES IN HOUSTON	Kamala Harris	2019-09-12	May I respond.	Democratic Presidential Debate - September 12 | ABC
1102159	ABC HOSTS 2019 DEMOCRATIC PRESIDENTIAL CANDIDATES DEBATES IN HOUSTON	Bernie Sanders	2019-09-12	Can I--	Democratic Presidential Debate - September 12 | ABC
1102160	ABC HOSTS 2019 DEMOCRATIC PRESIDENTIAL CANDIDATES DEBATES IN HOUSTON	Joe Biden	2019-09-12	Latinos should look at is comparing this president to the president we have is outrageous, number one. We didn't lock people up in cages, we didn't separate families, we didn't do all of those things. Number one.	Democratic Presidential Debate - September 12 | ABC
1102161	ABC HOSTS 2019 DEMOCRATIC PRESIDENTIAL CANDIDATES DEBATES IN HOUSTON	Joe Biden	2019-09-12	Number two--number two by the time this is a president that came along with a DACA program. No one had ever done that before. This president sent legislation to the desk saying he wants to find a pathway for the 11 million undocumented in the United States of America. This is a president who has done a great deal, so I'm proud to have served with him.	Democratic Presidential Debate - September 12 | ABC
1102162	ABC HOSTS 2019 DEMOCRATIC PRESIDENTIAL CANDIDATES DEBATES IN HOUSTON	Joe Biden	2019-09-12	What I would do as president is several more things because things have changed. I would in fact, make sure that there is we immediately surge to the border all those people are seeking asylum. They deserve to be heard. That's who we are. We are a nation that says if you want to flee and you're fleeing oppression you should come. I would change the order that the president just changed saying women who are being beaten and abused can no longer claim that as a reason for asylum. And by the way, retrospectively--you know, the 25th anniversary of the Violence Against Women Act is up. The Republican congress has not reauthorized it. Let's put pressure to pass the Violence Against Women Act now. Let them go back.	Democratic Presidential Debate - September 12 | ABC
1102163	ABC HOSTS 2019 DEMOCRATIC PRESIDENTIAL CANDIDATES DEBATES IN HOUSTON	Joe Biden	2019-09-12	The president did the best thing that was able to be done--	Democratic Presidential Debate - September 12 | ABC
1102164	ABC HOSTS 2019 DEMOCRATIC PRESIDENTIAL CANDIDATES DEBATES IN HOUSTON	Joe Biden	2019-09-12	I'm the vice president of the United States.	Democratic Presidential Debate - September 12 | ABC
1102165	ABC HOSTS 2019 DEMOCRATIC PRESIDENTIAL CANDIDATES DEBATES IN HOUSTON	Julian Castro	2019-09-12	You know I--	Democratic Presidential Debate - September 12 | ABC
1102166	ABC HOSTS 2019 DEMOCRATIC PRESIDENTIAL CANDIDATES DEBATES IN HOUSTON	Julian Castro	2019-09-12	Jorge, thank you very much for that question and look, I agree that Barack Obama was very different from Donald Trump. Donald Trump has a dark heart when it comes to immigrants. He builds his whole political career so far on scapegoating and fear mongering and otherising (PH) migrants and that's very different from Barack Obama.	Democratic Presidential Debate - September 12 | ABC
1102167	ABC HOSTS 2019 DEMOCRATIC PRESIDENTIAL CANDIDATES DEBATES IN HOUSTON	Julian Castro	2019-09-12	But my problem with Vice President Biden and Cory pointed this out last time is every time something good about Barack Obama comes up he says oh, I was there, I was there, I was there--that's me too. And then, every time somebody questions part of the administration that we were both part of he says well, that was the president. I mean, he wants to take credit for Obama's work but not have to answer to any questions.	Democratic Presidential Debate - September 12 | ABC
